al 8356481 ecr 8359136], length 880
10:35:43.467834 IP (tos 0x10, ttl 64, id 57211, offset 0, flags [DF], proto TCP (6), length 388)
    compute-0-0.local.ssh > cluster.local.58553: Flags [P.], cksum 0x2a89 (incorrect -> 0xa17a), seq 121360:121696, ack 97, win 188, options [nop,nop,TS val 8356482 ecr 8359136], length 336
10:35:43.468024 IP (tos 0x10, ttl 64, id 53684, offset 0, flags [DF], proto TCP (6), length 52)
    cluster.local.58553 > compute-0-0.local.ssh: Flags [.], cksum 0xedca (correct), seq 97, ack 121696, win 501, options [nop,nop,TS val 8359138 ecr 8356481], length 0
10:35:43.468834 IP (tos 0x10, ttl 64, id 57212, offset 0, flags [DF], proto TCP (6), length 644)
    compute-0-0.local.ssh > cluster.local.58553: Flags [P.], cksum 0x2b89 (incorrect -> 0x65d5), seq 121696:122288, ack 97, win 188, options [nop,nop,TS val 8356483 ecr 8359138], length 592
10:35:43.469832 IP (tos 0x10, ttl 64, id 57213, offset 0, flags [DF], proto TCP (6), length 388)
    compute-0-0.local.ssh > cluster.local.58553: Flags [P.], cksum 0x2a89 (incorrect -> 0xa734), seq 122288:122624, ack 97, win 188, options [nop,nop,TS val 8356484 ecr 8359138], length 336
10:35:43.469991 IP (tos 0x10, ttl 64, id 53685, offset 0, flags [DF], proto TCP (6), length 52)
    cluster.local.58553 > compute-0-0.local.ssh: Flags [.], cksum 0xea26 (correct), seq 97, ack 122624, win 501, options [nop,nop,TS val 8359140 ecr 8356483], length 0
10:35:43.470806 IP (tos 0x10, ttl 64, id 57214, offset 0, flags [DF], proto TCP (6), length 644)
    compute-0-0.local.ssh > cluster.local.58553: Flags [P.], cksum 0x2b89 (incorrect -> 0x65c4), seq 122624:123216, ack 97, win 188, options [nop,nop,TS val 8356485 ecr 8359140], length 592
10:35:43.471829 IP (tos 0x10, ttl 64, id 57215, offset 0, flags [DF], proto TCP (6), length 388)
    compute-0-0.local.ssh > cluster.local.58553: Flags [P.], cksum 0x2a89 (incorrect -> 0xb82d), seq 123216:123552, ack 97, win 188, options [nop,nop,TS val 8356486 ecr 8359140], length 336
10:35:43.471958 IP (tos 0x10, ttl 64, id 53686, offset 0, flags [DF], proto TCP (6), length 52)
    cluster.local.58553 > compute-0-0.local.ssh: Flags [.], cksum 0xe682 (correct), seq 97, ack 123552, win 501, options [nop,nop,TS val 8359142 ecr 8356485], length 0
10:35:43.472846 IP (tos 0x10, ttl 64, id 57216, offset 0, flags [DF], proto TCP (6), length 644)
    compute-0-0.local.ssh > cluster.local.58553: Flags [P.], cksum 0x2b89 (incorrect -> 0x79f7), seq 123552:124144, ack 97, win 188, options [nop,nop,TS val 8356487 ecr 8359142], length 592
10:35:43.473830 IP (tos 0x10, ttl 64, id 57217, offset 0, flags [DF], proto TCP (6), length 388)
    compute-0-0.local.ssh > cluster.local.58553: Flags [P.], cksum 0x2a89 (incorrect -> 0xaaf9), seq 124144:124480, ack 97, win 188, options [nop,nop,TS val 8356488 ecr 8359142], length 336
10:35:43.473985 IP (tos 0x10, ttl 64, id 53687, offset 0, flags [DF], proto TCP (6), length 52)
    cluster.local.58553 > compute-0-0.local.ssh: Flags [.], cksum 0xe2de (correct), seq 97, ack 124480, win 501, options [nop,nop,TS val 8359144 ecr 8356487], length 0
10:35:43.474886 IP (tos 0x10, ttl 64, id 57218, offset 0, flags [DF], proto TCP (6), length 644)
    compute-0-0.local.ssh > cluster.local.58553: Flags [P.], cksum 0x2b89 (incorrect -> 0x3f9d), seq 124480:125072, ack 97, win 188, options [nop,nop,TS val 8356489 ecr 8359144], length 592
10:35:43.475809 IP (tos 0x10, ttl 64, id 57219, offset 0, flags [DF], proto TCP (6), length 388)
    compute-0-0.local.ssh > cluster.local.58553: Flags [P.], cksum 0x2a89 (incorrect -> 0x7b52), seq 125072:125408, ack 97, win 188, options [nop,nop,TS val 8356490 ecr 8359144], length 336
10:35:43.475975 IP (tos 0x10, ttl 64, id 53688, offset 0, flags [DF], proto TCP (6), length 52)
    cluster.local.58553 > compute-0-0.local.ssh: Flags [.], cksum 0xdf3a (correct), seq 97, ack 125408, win 501, options [nop,nop,TS val 8359146 ecr 8356489], length 0
10:35:43.476831 IP (tos 0x10, ttl 64, id 57220, offset 0, flags [DF], proto TCP (6), length 644)
    compute-0-0.local.ssh > cluster.local.58553: Flags [P.], cksum 0x2b89 (incorrect -> 0x0e66), seq 125408:126000, ack 97, win 188, options [nop,nop,TS val 8356491 ecr 8359146], length 592
10:35:43.477827 IP (tos 0x10, ttl 64, id 57221, offset 0, flags [DF], proto TCP (6), length 388)
    compute-0-0.local.ssh > cluster.local.58553: Flags [P.], cksum 0x2a89 (incorrect -> 0xcaa9), seq 126000:126336, ack 97, win 188, options [nop,nop,TS val 8356492 ecr 8359146], length 336
10:35:43.477966 IP (tos 0x10, ttl 64, id 53689, offset 0, flags [DF], proto TCP (6), length 52)
    cluster.local.58553 > compute-0-0.local.ssh: Flags [.], cksum 0xdb96 (correct), seq 97, ack 126336, win 501, options [nop,nop,TS val 8359148 ecr 8356491], length 0
10:35:43.478830 IP (tos 0x10, ttl 64, id 57222, offset 0, flags [DF], proto TCP (6), length 644)
    compute-0-0.local.ssh > cluster.local.58553: Flags [P.], cksum 0x2b89 (incorrect -> 0x5347), seq 126336:126928, ack 97, win 188, options [nop,nop,TS val 8356493 ecr 8359148], length 592
10:35:43.479792 IP (tos 0x10, ttl 64, id 57223, offset 0, flags [DF], proto TCP (6), length 388)
    compute-0-0.local.ssh > cluster.local.58553: Flags [P.], cksum 0x2a89 (incorrect -> 0x1be2), seq 126928:127264, ack 97, win 188, options [nop,nop,TS val 8356494 ecr 8359148], length 336
10:35:43.479963 IP (tos 0x10, ttl 64, id 53690, offset 0, flags [DF], proto TCP (6), length 52)
    cluster.local.58553 > compute-0-0.local.ssh: Flags [.], cksum 0xd7f2 (correct), seq 97, ack 127264, win 501, options [nop,nop,TS val 8359150 ecr 8356493], length 0
10:35:43.480792 IP (tos 0x10, ttl 64, id 57224, offset 0, flags [DF], proto TCP (6), length 644)
    compute-0-0.local.ssh > cluster.local.58553: Flags [P.], cksum 0x2b89 (incorrect -> 0xed84), seq 127264:127856, ack 97, win 188, options [nop,nop,TS val 8356495 ecr 8359150], length 592
10:35:43.481786 IP (tos 0x10, ttl 64, id 57225, offset 0, flags [DF], proto TCP (6), length 388)
    compute-0-0.local.ssh > cluster.local.58553: Flags [P.], cksum 0x2a89 (incorrect -> 0x03ef), seq 127856:128192, ack 97, win 188, options [nop,nop,TS val 8356496 ecr 8359150], length 336
10:35:43.481935 IP (tos 0x10, ttl 64, id 53691, offset 0, flags [DF], proto TCP (6), length 52)
    cluster.local.58553 > compute-0-0.local.ssh: Flags [.], cksum 0xd44e (correct), seq 97, ack 128192, win 501, options [nop,nop,TS val 8359152 ecr 8356495], length 0
10:35:43.482807 IP (tos 0x10, ttl 64, id 57226, offset 0, flags [DF], proto TCP (6), length 644)
    compute-0-0.local.ssh > cluster.local.58553: Flags [P.], cksum 0x2b89 (incorrect -> 0x6514), seq 128192:128784, ack 97, win 188, options [nop,nop,TS val 8356497 ecr 8359152], length 592
10:35:43.483786 IP (tos 0x10, ttl 64, id 57227, offset 0, flags [DF], proto TCP (6), length 388)
    compute-0-0.local.ssh > cluster.local.58553: Flags [P.], cksum 0x2a89 (incorrect -> 0x26d3), seq 128784:129120, ack 97, win 188, options [nop,nop,TS val 8356498 ecr 8359152], length 336
10:35:43.483982 IP (tos 0x10, ttl 64, id 53692, offset 0, flags [DF], proto TCP (6), length 52)
    cluster.local.58553 > compute-0-0.local.ssh: Flags [.], cksum 0xd0aa (correct), seq 97, ack 129120, win 501, options [nop,nop,TS val 8359154 ecr 8356497], length 0
10:35:43.484809 IP (tos 0x10, ttl 64, id 57228, offset 0, flags [DF], proto TCP (6), length 644)
    compute-0-0.local.ssh > cluster.local.58553: Flags [P.], cksum 0x2b89 (incorrect -> 0x9932), seq 129120:129712, ack 97, win 188, options [nop,nop,TS val 8356499 ecr 8359154], length 592
10:35:43.485806 IP (tos 0x10, ttl 64, id 57229, offset 0, flags [DF], proto TCP (6), length 388)
    compute-0-0.local.ssh > cluster.local.58553: Flags [P.], cksum 0x2a89 (incorrect -> 0x332a), seq 129712:130048, ack 97, win 188, options [nop,nop,TS val 8356500 ecr 8359154], length 336
10:35:43.486006 IP (tos 0x10, ttl 64, id 53693, offset 0, flags [DF], proto TCP (6), length 52)
    cluster.local.58553 > compute-0-0.local.ssh: Flags [.], cksum 0xcd06 (correct), seq 97, ack 130048, win 501, options [nop,nop,TS val 8359156 ecr 8356499], length 0
10:35:43.486805 IP (tos 0x10, ttl 64, id 57230, offset 0, flags [DF], proto TCP (6), length 644)
    compute-0-0.local.ssh > cluster.local.58553: Flags [P.], cksum 0x2b89 (incorrect -> 0xddfb), seq 130048:130640, ack 97, win 188, options [nop,nop,TS val 8356501 ecr 8359156], length 592
10:35:43.486995 ARP, Ethernet (len 6), IPv4 (len 4), Request who-has 192.168.0.9 tell 192.168.0.23, length 46
10:35:43.487191 IP (tos 0x0, ttl 64, id 33429, offset 0, flags [DF], proto UDP (17), length 70)
    compute-0-0.local.52123 > cluster.local.domain: [bad udp cksum 5a22!] 12916+ PTR? 9.0.168.192.in-addr.arpa. (42)
10:35:43.487814 IP (tos 0x10, ttl 64, id 57231, offset 0, flags [DF], proto TCP (6), length 388)
    compute-0-0.local.ssh > cluster.local.58553: Flags [P.], cksum 0x2a89 (incorrect -> 0x610c), seq 130640:130976, ack 97, win 188, options [nop,nop,TS val 8356502 ecr 8359156], length 336
10:35:43.487959 IP (tos 0x10, ttl 64, id 53694, offset 0, flags [DF], proto TCP (6), length 52)
    cluster.local.58553 > compute-0-0.local.ssh: Flags [.], cksum 0xc962 (correct), seq 97, ack 130976, win 501, options [nop,nop,TS val 8359158 ecr 8356501], length 0
10:35:43.490016 IP (tos 0x0, ttl 64, id 39132, offset 0, flags [none], proto UDP (17), length 122)
    cluster.local.domain > compute-0-0.local.52123: [udp sum ok] 12916 NXDomain q: PTR? 9.0.168.192.in-addr.arpa. 0/1/0 ns: 168.192.in-addr.arpa. [3h] SOA 168.192.in-addr.arpa. nobody.localhost. 42 86400 43200 604800 10800 (94)
10:35:43.490171 IP (tos 0x0, ttl 64, id 33432, offset 0, flags [DF], proto UDP (17), length 71)
    compute-0-0.local.58782 > cluster.local.domain: [bad udp cksum 3458!] 61528+ PTR? 23.0.168.192.in-addr.arpa. (43)
10:35:43.492448 IP (tos 0x0, ttl 64, id 39133, offset 0, flags [none], proto UDP (17), length 123)
    cluster.local.domain > compute-0-0.local.58782: [udp sum ok] 61528 NXDomain q: PTR? 23.0.168.192.in-addr.arpa. 0/1/0 ns: 168.192.in-addr.arpa. [3h] SOA 168.192.in-addr.arpa. nobody.localhost. 42 86400 43200 604800 10800 (95)
10:35:43.492904 IP (tos 0x10, ttl 64, id 57232, offset 0, flags [DF], proto TCP (6), length 1500)
    compute-0-0.local.ssh > cluster.local.58553: Flags [.], cksum 0x2ee1 (incorrect -> 0x3c12), seq 130976:132424, ack 97, win 188, options [nop,nop,TS val 8356507 ecr 8359158], length 1448
10:35:43.492911 IP (tos 0x10, ttl 64, id 57233, offset 0, flags [DF], proto TCP (6), length 396)
    compute-0-0.local.ssh > cluster.local.58553: Flags [P.], cksum 0x2a91 (incorrect -> 0xfaaa), seq 132424:132768, ack 97, win 188, options [nop,nop,TS val 8356507 ecr 8359158], length 344
10:35:43.493116 IP (tos 0x10, ttl 64, id 53695, offset 0, flags [DF], proto TCP (6), length 52)
    cluster.local.58553 > compute-0-0.local.ssh: Flags [.], cksum 0xc257 (correct), seq 97, ack 132768, win 501, options [nop,nop,TS val 8359163 ecr 8356507], length 0
10:35:43.493840 IP (tos 0x10, ttl 64, id 57234, offset 0, flags [DF], proto TCP (6), length 932)
    compute-0-0.local.ssh > cluster.local.58553: Flags [P.], cksum 0x2ca9 (incorrect -> 0x9132), seq 132768:133648, ack 97, win 188, options [nop,nop,TS val 8356508 ecr 8359163], length 880
10:35:43.494835 IP (tos 0x10, ttl 64, id 57235, offset 0, flags [DF], proto TCP (6), length 388)
    compute-0-0.local.ssh > cluster.local.58553: Flags [P.], cksum 0x2a89 (incorrect -> 0x4ec2), seq 133648:133984, ack 97, win 188, options [nop,nop,TS val 8356509 ecr 8359163], length 336
10:35:43.495020 IP (tos 0x10, ttl 64, id 53696, offset 0, flags [DF], proto TCP (6), length 52)
    cluster.local.58553 > compute-0-0.local.ssh: Flags [.], cksum 0xbd94 (correct), seq 97, ack 133984, win 501, options [nop,nop,TS val 8359165 ecr 8356508], length 0
10:35:43.495834 IP (tos 0x10, ttl 64, id 57236, offset 0, flags [DF], proto TCP (6), length 644)
    compute-0-0.local.ssh > cluster.local.58553: Flags [P.], cksum 0x2b89 (incorrect -> 0x485a), seq 133984:134576, ack 97, win 188, options [nop,nop,TS val 8356510 ecr 8359165], length 592
10:35:43.496833 IP (tos 0x10, ttl 64, id 57237, offset 0, flags [DF], proto TCP (6), length 388)
    compute-0-0.local.ssh > cluster.local.58553: Flags [P.], cksum 0x2a89 (incorrect -> 0x685b), seq 134576:134912, ack 97, win 188, options [nop,nop,TS val 8356511 ecr 8359165], length 336
10:35:43.497056 IP (tos 0x10, ttl 64, id 53697, offset 0, flags [DF], proto TCP (6), length 52)
    cluster.local.58553 > compute-0-0.local.ssh: Flags [.], cksum 0xb9f0 (correct), seq 97, ack 134912, win 501, options [nop,nop,TS val 8359167 ecr 8356510], length 0
10:35:43.497834 IP (tos 0x10, ttl 64, id 57238, offset 0, flags [DF], proto TCP (6), length 644)
    compute-0-0.local.ssh > cluster.local.58553: Flags [P.], cksum 0x2b89 (incorrect -> 0x80fa), seq 134912:135504, ack 97, win 188, options [nop,nop,TS val 8356512 ecr 8359167], length 592
10:35:43.498831 IP (tos 0x10, ttl 64, id 57239, offset 0, flags [DF], proto TCP (6), length 388)
    compute-0-0.local.ssh > cluster.local.58553: Flags [P.], cksum 0x2a89 (incorrect -> 0xd3ea), seq 135504:135840, ack 97, win 188, options [nop,nop,TS val 8356513 ecr 8359167], length 336
10:35:43.498998 IP (tos 0x10, ttl 64, id 53698, offset 0, flags [DF], proto TCP (6), length 52)
    cluster.local.58553 > compute-0-0.local.ssh: Flags [.], cksum 0xb64c (correct), seq 97, ack 135840, win 501, options [nop,nop,TS val 8359169 ecr 8356512], length 0
10:35:43.499793 IP (tos 0x10, ttl 64, id 57240, offset 0, flags [DF], proto TCP (6), length 644)
    compute-0-0.local.ssh > cluster.local.58553: Flags [P.], cksum 0x2b89 (incorrect -> 0x8c45), seq 135840:136432, ack 97, win 188, options [nop,nop,TS val 8356514 ecr 8359169], length 592
10:35:43.500790 IP (tos 0x10, ttl 64, id 57241, offset 0, flags [DF], proto TCP (6), length 388)
    compute-0-0.local.ssh > cluster.local.58553: Flags [P.], cksum 0x2a89 (incorrect -> 0x6d6a), seq 136432:136768, ack 97, win 188, options [nop,nop,TS val 8356515 ecr 8359169], length 336
10:35:43.500940 IP (tos 0x10, ttl 64, id 53699, offset 0, flags [DF], proto TCP (6), length 52)
    cluster.local.58553 > compute-0-0.local.ssh: Flags [.], cksum 0xb2a8 (correct), seq 97, ack 136768, win 501, options [nop,nop,TS val 8359171 ecr 8356514], length 0
10:35:43.501777 IP (tos 0x10, ttl 64, id 57242, offset 0, flags [DF], proto TCP (6), length 644)
    compute-0-0.local.ssh > cluster.local.58553: Flags [P.], cksum 0x2b89 (incorrect -> 0xc3cd), seq 136768:137360, ack 97, win 188, options [nop,nop,TS val 8356516 ecr 8359171], length 592
10:35:43.502805 IP (tos 0x10, ttl 64, id 57243, offset 0, flags [DF], proto TCP (6), length 388)
    compute-0-0.local.ssh > cluster.local.58553: Flags [P.], cksum 0x2a89 (incorrect -> 0x871e), seq 137360:137696, ack 97, win 188, options [nop,nop,TS val 8356517 ecr 8359171], length 336
10:35:43.502945 IP (tos 0x10, ttl 64, id 53700, offset 0, flags [DF], proto TCP (6), length 52)
    cluster.local.58553 > compute-0-0.local.ssh: Flags [.], cksum 0xaf04 (correct), seq 97, ack 137696, win 501, options [nop,nop,TS val 8359173 ecr 8356516], length 0
10:35:43.503793 IP (tos 0x10, ttl 64, id 57244, offset 0, flags [DF], proto TCP (6), length 644)
    compute-0-0.local.ssh > cluster.local.58553: Flags [P.], cksum 0x2b89 (incorrect -> 0x7852), seq 137696:138288, ack 97, win 188, options [nop,nop,TS val 8356518 ecr 8359173], length 592
10:35:43.504791 IP (tos 0x10, ttl 64, id 57245, offset 0, flags [DF], proto TCP (6), length 388)
    compute-0-0.local.ssh > cluster.local.58553: Flags [P.], cksum 0x2a89 (incorrect -> 0xa0ae), seq 138288:138624, ack 97, win 188, options [nop,nop,TS val 8356519 ecr 8359173], length 336
10:35:43.504937 IP (tos 0x10, ttl 64, id 53701, offset 0, flags [DF], proto TCP (6), length 52)
    cluster.local.58553 > compute-0-0.local.ssh: Flags [.], cksum 0xab60 (correct), seq 97, ack 138624, win 501, options [nop,nop,TS val 8359175 ecr 8356518], length 0
10:35:43.505814 IP (tos 0x10, ttl 64, id 57246, offset 0, flags [DF], proto TCP (6), length 644)
    compute-0-0.local.ssh > cluster.local.58553: Flags [P.], cksum 0x2b89 (incorrect -> 0xdd34), seq 138624:139216, ack 97, win 188, options [nop,nop,TS val 8356520 ecr 8359175], length 592
10:35:43.506811 IP (tos 0x10, ttl 64, id 57247, offset 0, flags [DF], proto TCP (6), length 388)
    compute-0-0.local.ssh > cluster.local.58553: Flags [P.], cksum 0x2a89 (incorrect -> 0x192f), seq 139216:139552, ack 97, win 188, options [nop,nop,TS val 8356521 ecr 8359175], length 336
10:35:43.506967 IP (tos 0x10, ttl 64, id 53702, offset 0, flags [DF], proto TCP (6), length 52)
    cluster.local.58553 > compute-0-0.local.ssh: Flags [.], cksum 0xa7bc (correct), seq 97, ack 139552, win 501, options [nop,nop,TS val 8359177 ecr 8356520], length 0
10:35:43.507793 IP (tos 0x10, ttl 64, id 57248, offset 0, flags [DF], proto TCP (6), length 644)
    compute-0-0.local.ssh > cluster.local.58553: Flags [P.], cksum 0x2b89 (incorrect -> 0x22e9), seq 139552:140144, ack 97, win 188, options [nop,nop,TS val 8356522 ecr 8359177], length 592
10:35:43.508791 IP (tos 0x10, ttl 64, id 57249, offset 0, flags [DF], proto TCP (6), length 388)
    compute-0-0.local.ssh > cluster.local.58553: Flags [P.], cksum 0x2a89 (incorrect -> 0x105a), seq 140144:140480, ack 97, win 188, options [nop,nop,TS val 8356523 ecr 8359177], length 336
10:35:43.508937 IP (tos 0x10, ttl 64, id 53703, offset 0, flags [DF], proto TCP (6), length 52)
    cluster.local.58553 > compute-0-0.local.ssh: Flags [.], cksum 0xa418 (correct), seq 97, ack 140480, win 501, options [nop,nop,TS val 8359179 ecr 8356522], length 0
10:35:43.509799 IP (tos 0x10, ttl 64, id 57250, offset 0, flags [DF], proto TCP (6), length 644)
    compute-0-0.local.ssh > cluster.local.58553: Flags [P.], cksum 0x2b89 (incorrect -> 0x03d2), seq 140480:141072, ack 97, win 188, options [nop,nop,TS val 8356524 ecr 8359179], length 592
10:35:43.510791 IP (tos 0x10, ttl 64, id 57251, offset 0, flags [DF], proto TCP (6), length 388)
    compute-0-0.local.ssh > cluster.local.58553: Flags [P.], cksum 0x2a89 (incorrect -> 0x9f81), seq 141072:141408, ack 97, win 188, options [nop,nop,TS val 8356525 ecr 8359179], length 336
10:35:43.510924 IP (tos 0x10, ttl 64, id 53704, offset 0, flags [DF], proto TCP (6), length 52)
    cluster.local.58553 > compute-0-0.local.ssh: Flags [.], cksum 0xa074 (correct), seq 97, ack 141408, win 501, options [nop,nop,TS val 8359181 ecr 8356524], length 0
10:35:43.511829 IP (tos 0x10, ttl 64, id 57252, offset 0, flags [DF], proto TCP (6), length 644)
    compute-0-0.local.ssh > cluster.local.58553: Flags [P.], cksum 0x2b89 (incorrect -> 0x0dc6), seq 141408:142000, ack 97, win 188, options [nop,nop,TS val 8356526 ecr 8359181], length 592
10:35:43.512827 IP (tos 0x10, ttl 64, id 57253, offset 0, flags [DF], proto TCP (6), length 388)
    compute-0-0.local.ssh > cluster.local.58553: Flags [P.], cksum 0x2a89 (incorrect -> 0xe2f8), seq 142000:142336, ack 97, win 188, options [nop,nop,TS val 8356527 ecr 8359181], length 336
10:35:43.512963 IP (tos 0x10, ttl 64, id 53705, offset 0, flags [DF], proto TCP (6), length 52)
    cluster.local.58553 > compute-0-0.local.ssh: Flags [.], cksum 0x9cd0 (correct), seq 97, ack 142336, win 501, options [nop,nop,TS val 8359183 ecr 8356526], length 0
10:35:43.513827 IP (tos 0x10, ttl 64, id 57254, offset 0, flags [DF], proto TCP (6), length 644)
    compute-0-0.local.ssh > cluster.local.58553: Flags [P.], cksum 0x2b89 (incorrect -> 0x4583), seq 142336:142928, ack 97, win 188, options [nop,nop,TS val 8356528 ecr 8359183], length 592
10:35:43.514790 IP (tos 0x10, ttl 64, id 57255, offset 0, flags [DF], proto TCP (6), length 388)
    compute-0-0.local.ssh > cluster.local.58553: Flags [P.], cksum 0x2a89 (incorrect -> 0x531e), seq 142928:143264, ack 97, win 188, options [nop,nop,TS val 8356529 ecr 8359183], length 336
10:35:43.514950 IP (tos 0x10, ttl 64, id 53706, offset 0, flags [DF], proto TCP (6), length 52)
    cluster.local.58553 > compute-0-0.local.ssh: Flags [.], cksum 0x992c (correct), seq 97, ack 143264, win 501, options [nop,nop,TS val 8359185 ecr 8356528], length 0
10:35:43.515813 IP (tos 0x10, ttl 64, id 57256, offset 0, flags [DF], proto TCP (6), length 644)
    compute-0-0.local.ssh > cluster.local.58553: Flags [P.], cksum 0x2b89 (incorrect -> 0x0be2), seq 143264:143856, ack 97, win 188, options [nop,nop,TS val 8356530 ecr 8359185], length 592
10:35:43.516806 IP (tos 0x10, ttl 64, id 57257, offset 0, flags [DF], proto TCP (6), length 388)
    compute-0-0.local.ssh > cluster.local.58553: Flags [P.], cksum 0x2a89 (incorrect -> 0xe0e0), seq 143856:144192, ack 97, win 188, options [nop,nop,TS val 8356531 ecr 8359185], length 336
10:35:43.516929 IP (tos 0x10, ttl 64, id 53707, offset 0, flags [DF], proto TCP (6), length 52)
    cluster.local.58553 > compute-0-0.local.ssh: Flags [.], cksum 0x9588 (correct), seq 97, ack 144192, win 501, options [nop,nop,TS val 8359187 ecr 8356530], length 0
10:35:43.517789 IP (tos 0x10, ttl 64, id 57258, offset 0, flags [DF], proto TCP (6), length 644)
    compute-0-0.local.ssh > cluster.local.58553: Flags [P.], cksum 0x2b89 (incorrect -> 0xae84), seq 144192:144784, ack 97, win 188, options [nop,nop,TS val 8356532 ecr 8359187], length 592
10:35:43.518788 IP (tos 0x10, ttl 64, id 57259, offset 0, flags [DF], proto TCP (6), length 388)
    compute-0-0.local.ssh > cluster.local.58553: Flags [P.], cksum 0x2a89 (incorrect -> 0xdb1a), seq 144784:145120, ack 97, win 188, options [nop,nop,TS val 8356533 ecr 8359187], length 336
10:35:43.518948 IP (tos 0x10, ttl 64, id 53708, offset 0, flags [DF], proto TCP (6), length 52)
    cluster.local.58553 > compute-0-0.local.ssh: Flags [.], cksum 0x91e4 (correct), seq 97, ack 145120, win 501, options [nop,nop,TS val 8359189 ecr 8356532], length 0
10:35:43.519807 IP (tos 0x10, ttl 64, id 57260, offset 0, flags [DF], proto TCP (6), length 644)
    compute-0-0.local.ssh > cluster.local.58553: Flags [P.], cksum 0x2b89 (incorrect -> 0x7825), seq 145120:145712, ack 97, win 188, options [nop,nop,TS val 8356534 ecr 8359189], length 592
10:35:43.520831 IP (tos 0x10, ttl 64, id 57261, offset 0, flags [DF], proto TCP (6), length 388)
    compute-0-0.local.ssh > cluster.local.58553: Flags [P.], cksum 0x2a89 (incorrect -> 0xd2da), seq 145712:146048, ack 97, win 188, options [nop,nop,TS val 8356535 ecr 8359189], length 336
10:35:43.521013 IP (tos 0x10, ttl 64, id 53709, offset 0, flags [DF], proto TCP (6), length 52)
    cluster.local.58553 > compute-0-0.local.ssh: Flags [.], cksum 0x8e40 (correct), seq 97, ack 146048, win 501, options [nop,nop,TS val 8359191 ecr 8356534], length 0
10:35:43.521831 IP (tos 0x10, ttl 64, id 57262, offset 0, flags [DF], proto TCP (6), length 644)
    compute-0-0.local.ssh > cluster.local.58553: Flags [P.], cksum 0x2b89 (incorrect -> 0xbc94), seq 146048:146640, ack 97, win 188, options [nop,nop,TS val 8356536 ecr 8359191], length 592
10:35:43.522828 IP (tos 0x10, ttl 64, id 57263, offset 0, flags [DF], proto TCP (6), length 388)
    compute-0-0.local.ssh > cluster.local.58553: Flags [P.], cksum 0x2a89 (incorrect -> 0x6181), seq 146640:146976, ack 97, win 188, options [nop,nop,TS val 8356537 ecr 8359191], length 336
10:35:43.522958 IP (tos 0x10, ttl 64, id 53710, offset 0, flags [DF], proto TCP (6), length 52)
    cluster.local.58553 > compute-0-0.local.ssh: Flags [.], cksum 0x8a9c (correct), seq 97, ack 146976, win 501, options [nop,nop,TS val 8359193 ecr 8356536], length 0
10:35:43.523846 IP (tos 0x10, ttl 64, id 57264, offset 0, flags [DF], proto TCP (6), length 644)
    compute-0-0.local.ssh > cluster.local.58553: Flags [P.], cksum 0x2b89 (incorrect -> 0x85ea), seq 146976:147568, ack 97, win 188, options [nop,nop,TS val 8356538 ecr 8359193], length 592
10:35:43.524828 IP (tos 0x10, ttl 64, id 57265, offset 0, flags [DF], proto TCP (6), length 388)
    compute-0-0.local.ssh > cluster.local.58553: Flags [P.], cksum 0x2a89 (incorrect -> 0xc9fc), seq 147568:147904, ack 97, win 188, options [nop,nop,TS val 8356539 ecr 8359193], length 336
10:35:43.525038 IP (tos 0x10, ttl 64, id 53711, offset 0, flags [DF], proto TCP (6), length 52)
    cluster.local.58553 > compute-0-0.local.ssh: Flags [.], cksum 0x86f8 (correct), seq 97, ack 147904, win 501, options [nop,nop,TS val 8359195 ecr 8356538], length 0
10:35:43.525878 IP (tos 0x10, ttl 64, id 57266, offset 0, flags [DF], proto TCP (6), length 644)
    compute-0-0.local.ssh > cluster.local.58553: Flags [P.], cksum 0x2b89 (incorrect -> 0xf6d5), seq 147904:148496, ack 97, win 188, options [nop,nop,TS val 8356540 ecr 8359195], length 592
10:35:43.526847 IP (tos 0x10, ttl 64, id 57267, offset 0, flags [DF], proto TCP (6), length 388)
    compute-0-0.local.ssh > cluster.local.58553: Flags [P.], cksum 0x2a89 (incorrect -> 0x4c33), seq 148496:148832, ack 97, win 188, options [nop,nop,TS val 8356541 ecr 8359195], length 336
10:35:43.526941 IP (tos 0x10, ttl 64, id 53712, offset 0, flags [DF], proto TCP (6), length 52)
    cluster.local.58553 > compute-0-0.local.ssh: Flags [.], cksum 0x8354 (correct), seq 97, ack 148832, win 501, options [nop,nop,TS val 8359197 ecr 8356540], length 0
10:35:43.527791 IP (tos 0x10, ttl 64, id 57268, offset 0, flags [DF], proto TCP (6), length 644)
    compute-0-0.local.ssh > cluster.local.58553: Flags [P.], cksum 0x2b89 (incorrect -> 0x54ef), seq 148832:149424, ack 97, win 188, options [nop,nop,TS val 8356542 ecr 8359197], length 592
10:35:43.528787 IP (tos 0x10, ttl 64, id 57269, offset 0, flags [DF], proto TCP (6), length 388)
    compute-0-0.local.ssh > cluster.local.58553: Flags [P.], cksum 0x2a89 (incorrect -> 0x9d12), seq 149424:149760, ack 97, win 188, options [nop,nop,TS val 8356543 ecr 8359197], length 336
10:35:43.528938 IP (tos 0x10, ttl 64, id 53713, offset 0, flags [DF], proto TCP (6), length 52)
    cluster.local.58553 > compute-0-0.local.ssh: Flags [.], cksum 0x7fb0 (correct), seq 97, ack 149760, win 501, options [nop,nop,TS val 8359199 ecr 8356542], length 0
10:35:43.529796 IP (tos 0x10, ttl 64, id 57270, offset 0, flags [DF], proto TCP (6), length 644)
    compute-0-0.local.ssh > cluster.local.58553: Flags [P.], cksum 0x2b89 (incorrect -> 0x63ab), seq 149760:150352, ack 97, win 188, options [nop,nop,TS val 8356544 ecr 8359199], length 592
10:35:43.530786 IP (tos 0x10, ttl 64, id 57271, offset 0, flags [DF], proto TCP (6), length 388)
    compute-0-0.local.ssh > cluster.local.58553: Flags [P.], cksum 0x2a89 (incorrect -> 0xb24a), seq 150352:150688, ack 97, win 188, options [nop,nop,TS val 8356545 ecr 8359199], length 336
10:35:43.530936 IP (tos 0x10, ttl 64, id 53714, offset 0, flags [DF], proto TCP (6), length 52)
    cluster.local.58553 > compute-0-0.local.ssh: Flags [.], cksum 0x7c0c (correct), seq 97, ack 150688, win 501, options [nop,nop,TS val 8359201 ecr 8356544], length 0
10:35:43.531804 IP (tos 0x10, ttl 64, id 57272, offset 0, flags [DF], proto TCP (6), length 644)
    compute-0-0.local.ssh > cluster.local.58553: Flags [P.], cksum 0x2b89 (incorrect -> 0xb77f), seq 150688:151280, ack 97, win 188, options [nop,nop,TS val 8356546 ecr 8359201], length 592
10:35:43.532786 IP (tos 0x10, ttl 64, id 57273, offset 0, flags [DF], proto TCP (6), length 388)
    compute-0-0.local.ssh > cluster.local.58553: Flags [P.], cksum 0x2a89 (incorrect -> 0x850b), seq 151280:151616, ack 97, win 188, options [nop,nop,TS val 8356547 ecr 8359201], length 336
10:35:43.532944 IP (tos 0x10, ttl 64, id 53715, offset 0, flags [DF], proto TCP (6), length 52)
    cluster.local.58553 > compute-0-0.local.ssh: Flags [.], cksum 0x7868 (correct), seq 97, ack 151616, win 501, options [nop,nop,TS val 8359203 ecr 8356546], length 0
10:35:43.533790 IP (tos 0x10, ttl 64, id 57274, offset 0, flags [DF], proto TCP (6), length 644)
    compute-0-0.local.ssh > cluster.local.58553: Flags [P.], cksum 0x2b89 (incorrect -> 0xfaf6), seq 151616:152208, ack 97, win 188, options [nop,nop,TS val 8356548 ecr 8359203], length 592
10:35:43.534786 IP (tos 0x10, ttl 64, id 57275, offset 0, flags [DF], proto TCP (6), length 388)
    compute-0-0.local.ssh > cluster.local.58553: Flags [P.], cksum 0x2a89 (incorrect -> 0x4ea8), seq 152208:152544, ack 97, win 188, options [nop,nop,TS val 8356549 ecr 8359203], length 336
10:35:43.534993 IP (tos 0x10, ttl 64, id 53716, offset 0, flags [DF], proto TCP (6), length 52)
    cluster.local.58553 > compute-0-0.local.ssh: Flags [.], cksum 0x74c4 (correct), seq 97, ack 152544, win 501, options [nop,nop,TS val 8359205 ecr 8356548], length 0
10:35:43.535809 IP (tos 0x10, ttl 64, id 57276, offset 0, flags [DF], proto TCP (6), length 644)
    compute-0-0.local.ssh > cluster.local.58553: Flags [P.], cksum 0x2b89 (incorrect -> 0x043f), seq 152544:153136, ack 97, win 188, options [nop,nop,TS val 8356550 ecr 8359205], length 592
10:35:43.536764 IP (tos 0x10, ttl 64, id 57277, offset 0, flags [DF], proto TCP (6), length 388)
    compute-0-0.local.ssh > cluster.local.58553: Flags [P.], cksum 0x2a89 (incorrect -> 0xbd75), seq 153136:153472, ack 97, win 188, options [nop,nop,TS val 8356551 ecr 8359205], length 336
10:35:43.536900 IP (tos 0x10, ttl 64, id 53717, offset 0, flags [DF], proto TCP (6), length 52)
    cluster.local.58553 > compute-0-0.local.ssh: Flags [.], cksum 0x7120 (correct), seq 97, ack 153472, win 501, options [nop,nop,TS val 8359207 ecr 8356550], length 0
10:35:43.537790 IP (tos 0x10, ttl 64, id 57278, offset 0, flags [DF], proto TCP (6), length 644)
    compute-0-0.local.ssh > cluster.local.58553: Flags [P.], cksum 0x2b89 (incorrect -> 0x04f9), seq 153472:154064, ack 97, win 188, options [nop,nop,TS val 8356552 ecr 8359207], length 592
10:35:43.538786 IP (tos 0x10, ttl 64, id 57279, offset 0, flags [DF], proto TCP (6), length 388)
    compute-0-0.local.ssh > cluster.local.58553: Flags [P.], cksum 0x2a89 (incorrect -> 0x37ca), seq 154064:154400, ack 97, win 188, options [nop,nop,TS val 8356553 ecr 8359207], length 336
10:35:43.538960 IP (tos 0x10, ttl 64, id 53718, offset 0, flags [DF], proto TCP (6), length 52)
    cluster.local.58553 > compute-0-0.local.ssh: Flags [.], cksum 0x6d7c (correct), seq 97, ack 154400, win 501, options [nop,nop,TS val 8359209 ecr 8356552], length 0
10:35:43.539808 IP (tos 0x10, ttl 64, id 57280, offset 0, flags [DF], proto TCP (6), length 644)
    compute-0-0.local.ssh > cluster.local.58553: Flags [P.], cksum 0x2b89 (incorrect -> 0x91df), seq 154400:154992, ack 97, win 188, options [nop,nop,TS val 8356554 ecr 8359209], length 592
10:35:43.540786 IP (tos 0x10, ttl 64, id 57281, offset 0, flags [DF], proto TCP (6), length 388)
    compute-0-0.local.ssh > cluster.local.58553: Flags [P.], cksum 0x2a89 (incorrect -> 0xa144), seq 154992:155328, ack 97, win 188, options [nop,nop,TS val 8356555 ecr 8359209], length 336
10:35:43.540942 IP (tos 0x10, ttl 64, id 53719, offset 0, flags [DF], proto TCP (6), length 52)
    cluster.local.58553 > compute-0-0.local.ssh: Flags [.], cksum 0x69d8 (correct), seq 97, ack 155328, win 501, options [nop,nop,TS val 8359211 ecr 8356554], length 0
10:35:43.541790 IP (tos 0x10, ttl 64, id 57282, offset 0, flags [DF], proto TCP (6), length 644)
    compute-0-0.local.ssh > cluster.local.58553: Flags [P.], cksum 0x2b89 (incorrect -> 0xf1a4), seq 155328:155920, ack 97, win 188, options [nop,nop,TS val 8356556 ecr 8359211], length 592
10:35:43.542786 IP (tos 0x10, ttl 64, id 57283, offset 0, flags [DF], proto TCP (6), length 388)
    compute-0-0.local.ssh > cluster.local.58553: Flags [P.], cksum 0x2a89 (incorrect -> 0xb3d7), seq 155920:156256, ack 97, win 188, options [nop,nop,TS val 8356557 ecr 8359211], length 336
10:35:43.542953 IP (tos 0x10, ttl 64, id 53720, offset 0, flags [DF], proto TCP (6), length 52)
    cluster.local.58553 > compute-0-0.local.ssh: Flags [.], cksum 0x6634 (correct), seq 97, ack 156256, win 501, options [nop,nop,TS val 8359213 ecr 8356556], length 0
10:35:43.543788 IP (tos 0x10, ttl 64, id 57284, offset 0, flags [DF], proto TCP (6), length 644)
    compute-0-0.local.ssh > cluster.local.58553: Flags [P.], cksum 0x2b89 (incorrect -> 0xc120), seq 156256:156848, ack 97, win 188, options [nop,nop,TS val 8356558 ecr 8359213], length 592
10:35:43.544787 IP (tos 0x10, ttl 64, id 57285, offset 0, flags [DF], proto TCP (6), length 388)
    compute-0-0.local.ssh > cluster.local.58553: Flags [P.], cksum 0x2a89 (incorrect -> 0x6159), seq 156848:157184, ack 97, win 188, options [nop,nop,TS val 8356559 ecr 8359213], length 336
10:35:43.544955 IP (tos 0x10, ttl 64, id 53721, offset 0, flags [DF], proto TCP (6), length 52)
    cluster.local.58553 > compute-0-0.local.ssh: Flags [.], cksum 0x6290 (correct), seq 97, ack 157184, win 501, options [nop,nop,TS val 8359215 ecr 8356558], length 0
10:35:43.545810 IP (tos 0x10, ttl 64, id 57286, offset 0, flags [DF], proto TCP (6), length 644)
    compute-0-0.local.ssh > cluster.local.58553: Flags [P.], cksum 0x2b89 (incorrect -> 0xbef9), seq 157184:157776, ack 97, win 188, options [nop,nop,TS val 8356560 ecr 8359215], length 592
10:35:43.546832 IP (tos 0x10, ttl 64, id 57287, offset 0, flags [DF], proto TCP (6), length 388)
    compute-0-0.local.ssh > cluster.local.58553: Flags [P.], cksum 0x2a89 (incorrect -> 0x0960), seq 157776:158112, ack 97, win 188, options [nop,nop,TS val 8356561 ecr 8359215], length 336
10:35:43.547036 IP (tos 0x10, ttl 64, id 53722, offset 0, flags [DF], proto TCP (6), length 52)
    cluster.local.58553 > compute-0-0.local.ssh: Flags [.], cksum 0x5eec (correct), seq 97, ack 158112, win 501, options [nop,nop,TS val 8359217 ecr 8356560], length 0
10:35:43.547789 IP (tos 0x10, ttl 64, id 57288, offset 0, flags [DF], proto TCP (6), length 644)
    compute-0-0.local.ssh > cluster.local.58553: Flags [P.], cksum 0x2b89 (incorrect -> 0xfbbf), seq 158112:158704, ack 97, win 188, options [nop,nop,TS val 8356562 ecr 8359217], length 592
10:35:43.548158 IP (tos 0x10, ttl 64, id 53723, offset 0, flags [DF], proto TCP (6), length 100)
    cluster.local.58553 > compute-0-0.local.ssh: Flags [P.], cksum 0xa7c3 (correct), seq 97:145, ack 158704, win 501, options [nop,nop,TS val 8359218 ecr 8356562], length 48
10:35:43.548282 IP (tos 0x10, ttl 64, id 57289, offset 0, flags [DF], proto TCP (6), length 660)
    compute-0-0.local.ssh > cluster.local.58553: Flags [P.], cksum 0x2b99 (incorrect -> 0x5d59), seq 158704:159312, ack 145, win 188, options [nop,nop,TS val 8356562 ecr 8359218], length 608
10:35:43.548788 IP (tos 0x10, ttl 64, id 57290, offset 0, flags [DF], proto TCP (6), length 388)
    compute-0-0.local.ssh > cluster.local.58553: Flags [P.], cksum 0x2a89 (incorrect -> 0xae54), seq 159312:159648, ack 145, win 188, options [nop,nop,TS val 8356563 ecr 8359218], length 336
10:35:43.548987 IP (tos 0x10, ttl 64, id 53724, offset 0, flags [DF], proto TCP (6), length 52)
    cluster.local.58553 > compute-0-0.local.ssh: Flags [.], cksum 0x58b8 (correct), seq 145, ack 159648, win 501, options [nop,nop,TS val 8359219 ecr 8356562], length 0
10:35:43.549809 IP (tos 0x10, ttl 64, id 57291, offset 0, flags [DF], proto TCP (6), length 644)
    compute-0-0.local.ssh > cluster.local.58553: Flags [P.], cksum 0x2b89 (incorrect -> 0xb370), seq 159648:160240, ack 145, win 188, options [nop,nop,TS val 8356564 ecr 8359219], length 592
10:35:43.550807 IP (tos 0x10, ttl 64, id 57292, offset 0, flags [DF], proto TCP (6), length 388)
    compute-0-0.local.ssh > cluster.local.58553: Flags [P.], cksum 0x2a89 (incorrect -> 0xc328), seq 160240:160576, ack 145, win 188, options [nop,nop,TS val 8356565 ecr 8359219], length 336
10:35:43.550983 IP (tos 0x10, ttl 64, id 53725, offset 0, flags [DF], proto TCP (6), length 52)
    cluster.local.58553 > compute-0-0.local.ssh: Flags [.], cksum 0x5514 (correct), seq 145, ack 160576, win 501, options [nop,nop,TS val 8359221 ecr 8356564], length 0
10:35:43.551810 IP (tos 0x10, ttl 64, id 57293, offset 0, flags [DF], proto TCP (6), length 644)
    compute-0-0.local.ssh > cluster.local.58553: Flags [P.], cksum 0x2b89 (incorrect -> 0xb814), seq 160576:161168, ack 145, win 188, options [nop,nop,TS val 8356566 ecr 8359221], length 592
10:35:43.552808 IP (tos 0x10, ttl 64, id 57294, offset 0, flags [DF], proto TCP (6), length 388)
    compute-0-0.local.ssh > cluster.local.58553: Flags [P.], cksum 0x2a89 (incorrect -> 0xfd53), seq 161168:161504, ack 145, win 188, options [nop,nop,TS val 8356567 ecr 8359221], length 336
10:35:43.552964 IP (tos 0x10, ttl 64, id 53726, offset 0, flags [DF], proto TCP (6), length 52)
    cluster.local.58553 > compute-0-0.local.ssh: Flags [.], cksum 0x5170 (correct), seq 145, ack 161504, win 501, options [nop,nop,TS val 8359223 ecr 8356566], length 0
10:35:43.553789 IP (tos 0x10, ttl 64, id 57295, offset 0, flags [DF], proto TCP (6), length 644)
    compute-0-0.local.ssh > cluster.local.58553: Flags [P.], cksum 0x2b89 (incorrect -> 0xcd95), seq 161504:162096, ack 145, win 188, options [nop,nop,TS val 8356568 ecr 8359223], length 592
10:35:43.554778 IP (tos 0x10, ttl 64, id 57296, offset 0, flags [DF], proto TCP (6), length 388)
    compute-0-0.local.ssh > cluster.local.58553: Flags [P.], cksum 0x2a89 (incorrect -> 0x045f), seq 162096:162432, ack 145, win 188, options [nop,nop,TS val 8356569 ecr 8359223], length 336
10:35:43.554979 IP (tos 0x10, ttl 64, id 53727, offset 0, flags [DF], proto TCP (6), length 52)
    cluster.local.58553 > compute-0-0.local.ssh: Flags [.], cksum 0x4dcc (correct), seq 145, ack 162432, win 501, options [nop,nop,TS val 8359225 ecr 8356568], length 0
10:35:43.555783 IP (tos 0x10, ttl 64, id 57297, offset 0, flags [DF], proto TCP (6), length 644)
    compute-0-0.local.ssh > cluster.local.58553: Flags [P.], cksum 0x2b89 (incorrect -> 0xa6fe), seq 162432:163024, ack 145, win 188, options [nop,nop,TS val 8356570 ecr 8359225], length 592
10:35:43.556776 IP (tos 0x10, ttl 64, id 57298, offset 0, flags [DF], proto TCP (6), length 388)
    compute-0-0.local.ssh > cluster.local.58553: Flags [P.], cksum 0x2a89 (incorrect -> 0x94f2), seq 163024:163360, ack 145, win 188, options [nop,nop,TS val 8356571 ecr 8359225], length 336
10:35:43.557014 IP (tos 0x10, ttl 64, id 53728, offset 0, flags [DF], proto TCP (6), length 52)
    cluster.local.58553 > compute-0-0.local.ssh: Flags [.], cksum 0x4a28 (correct), seq 145, ack 163360, win 501, options [nop,nop,TS val 8359227 ecr 8356570], length 0
10:35:43.557813 IP (tos 0x10, ttl 64, id 57299, offset 0, flags [DF], proto TCP (6), length 644)
    compute-0-0.local.ssh > cluster.local.58553: Flags [P.], cksum 0x2b89 (incorrect -> 0x9a28), seq 163360:163952, ack 145, win 188, options [nop,nop,TS val 8356572 ecr 8359227], length 592
10:35:43.558809 IP (tos 0x10, ttl 64, id 57300, offset 0, flags [DF], proto TCP (6), length 388)
    compute-0-0.local.ssh > cluster.local.58553: Flags [P.], cksum 0x2a89 (incorrect -> 0x2867), seq 163952:164288, ack 145, win 188, options [nop,nop,TS val 8356573 ecr 8359227], length 336
10:35:43.558970 IP (tos 0x10, ttl 64, id 53729, offset 0, flags [DF], proto TCP (6), length 52)
    cluster.local.58553 > compute-0-0.local.ssh: Flags [.], cksum 0x4684 (correct), seq 145, ack 164288, win 501, options [nop,nop,TS val 8359229 ecr 8356572], length 0
10:35:43.559813 IP (tos 0x10, ttl 64, id 57301, offset 0, flags [DF], proto TCP (6), length 644)
    compute-0-0.local.ssh > cluster.local.58553: Flags [P.], cksum 0x2b89 (incorrect -> 0xeb51), seq 164288:164880, ack 145, win 188, options [nop,nop,TS val 8356574 ecr 8359229], length 592
10:35:43.560809 IP (tos 0x10, ttl 64, id 57302, offset 0, flags [DF], proto TCP (6), length 388)
